subreddit,title,score,num_comments,id,url
politics,Trump’s Goons Topple 12-Foot Statue of Him and Epstein. | The 12-foot bronze had got a permit from the federal government—but then vanished.,29420,855,1npoaao,https://www.thedailybeast.com/trump-and-epstein-statue-in-dc-vanishes-despite-legal-permit/
politics,Keystone Kash Faces Backlash Over ICE Bullet Sharpie Post,8202,862,1npozut,https://www.thedailybeast.com/keystone-kash-faces-backlash-over-ice-bullet-sharpie-post/?utm_source=twitter_owned_tdb&utm_medium=socialflow&utm_campaign=owned_social&via=twitter_page
politics,Man Who Called Trump “Hitler” Lectures Us on Calling People Nazis,7408,140,1npm8dj,https://newrepublic.com/post/200896/jd-vance-donald-trump-hitler-lectures-calling-people-nazis
politics,"Fox News' Jesse Watters Calls to 'Bomb' U.N., or 'Maybe Gas It' After Broken Escalator and Teleprompter During Trump's Visit",20040,1548,1npfpie,https://people.com/jesse-watters-calls-bomb-un-after-teleprompter-escalator-malfunctions-11816183?utm_campaign=peoplemagazine&utm_medium=social&utm_source=reddit.com&utm_content=post
politics,Massie says he has the signatures to force US House vote on releasing Epstein files,5126,95,1npn3wu,https://kentuckylantern.com/2025/09/24/massie-says-he-has-the-votes-needed-to-force-u-s-house-vote-on-releasing-epstein-files/
politics,Trump’s DOJ May Have Violated Luigi Mangione’s Right to a Fair Trial - A judge found the issue could go as high as Attorney General Pam Bondi.,9038,500,1npijg6,https://newrepublic.com/post/200870/donald-trump-doj-luigi-mangione-right-fair-trial
politics,Trump Threatens Jimmy Kimmel—Again—and Destroys MAGA’s Entire Defense,18096,932,1npdlqs,https://newrepublic.com/post/200844/trump-threatens-jimmy-kimmel-again-return-maga-defense?utm_source=Twitter&utm_term=Autofeed&utm_medium=social&utm_campaign=SF_TNR
politics,JD Vance Rushes to Exploit ICE Shooting Before Knowing Any Details,10419,930,1npf5o5,https://newrepublic.com/post/200857/jd-vance-kristi-noem-dallas-ice-shooting
politics,WHO rejects Trump’s claims of link between Tylenol and autism,2909,98,1npogy9,https://www.theguardian.com/world/2025/sep/24/world-health-organization-trump-autism-tylenol
politics,"Justice Dept officials' statements on Luigi Mangione broke court rules, judge says",6606,336,1nphqzs,https://www.reuters.com/legal/government/justice-dept-officials-statements-luigi-mangione-broke-court-rules-judge-says-2025-09-24/
politics,JD Vance reacts to Kimmel’s returning monologue: ‘He didn’t actually say sorry’,2893,1090,1npn62n,https://fox8.com/news/jd-vance-reacts-to-kimmels-returning-monologue-he-didnt-actually-say-sorry/
politics,Turns Out Trump’s Own Team Messed Up U.N. Escalator and Teleprompter,53171,1766,1np9hz9,https://newrepublic.com/post/200833/trump-team-messed-up-un-escalator-teleprompter
politics,Fawning MAGA Senator Pushes Trump to Seek Illegal Third Term,4939,419,1nphzdm,https://www.thedailybeast.com/maga-senator-pushes-trump-to-seek-illegal-third-term-i-hope-this-never-ends/
politics,"Donald Trump should apologize to Canada for 51st state comments, Louisiana Lt.-Gov. says",1527,188,1nprbvk,https://nationalpost.com/news/donald-trump-should-apologize-to-canada-for-51st-state-comments-louisiana-lt-gov-says
politics,Top GOP and White House allies working behind the scenes to prevent Epstein vote on House floor,863,75,1npuwid,https://www.cnn.com/2025/09/24/politics/epstein-files-house-gop-block
politics,Trump's U.N. speech was mortifying for America,2446,255,1npmgmc,https://www.msnbc.com/opinion/msnbc-opinion/trump-un-speech-peace-hell-rcna233283
politics,"Former FBI director Comey to be indicted in Virginia soon, MSNBC reports",2566,512,1nplo90,https://www.reuters.com/world/us/former-fbi-director-comey-be-indicted-virginia-soon-msnbc-reports-2025-09-24/
politics,Epstein Files Incoming?!? House Finally Has Magic Number To Demand Docs.,5287,208,1npdzg6,https://www.huffpost.com/entry/special-election-result-epstein-files_n_68d39b05e4b0ae58bfe9cb36/
politics,No President Should Have This Kind of Power,745,91,1nptakv,https://www.nytimes.com/2025/09/24/opinion/trump-caribbean-sea-boats-military.html?unlocked_article_code=1.oU8.bi5t.aj7ZSaiCInnY&smid=re-nytopinion
politics,"California Gov. Gavin Newsom tells Stephen Colbert ""I fear we will not have an election in 2028 unless we wake up""",3590,260,1npf6pn,https://www.cbsnews.com/amp/sacramento/news/gavin-newsom-late-show-stephen-colbert-trump/
PoliticalDiscussion,Casual Questions Thread,91,8546,1bwbuka,https://www.reddit.com/r/PoliticalDiscussion/comments/1bwbuka/casual_questions_thread/
PoliticalDiscussion,Is the American population beginning to turn on Trump?,191,183,1npqsfb,https://www.reddit.com/r/PoliticalDiscussion/comments/1npqsfb/is_the_american_population_beginning_to_turn_on/
PoliticalDiscussion,What would be the political implications of Andrew Cuomo winning the NYC mayoral election?,23,47,1nponax,https://www.reddit.com/r/PoliticalDiscussion/comments/1nponax/what_would_be_the_political_implications_of/
PoliticalDiscussion,"Donald Trump now claims to have learned that Ukraine with the help of Europe and particularly its NATO allies can not only retake all its territories but perhaps even more; Calling Russia a ""Paper Tiger."" Is the Alaskan Summit goals for peace between Ukraine and Russia now completely dead?",526,130,1np1rv1,https://www.reddit.com/r/PoliticalDiscussion/comments/1np1rv1/donald_trump_now_claims_to_have_learned_that/
PoliticalDiscussion,"Why is the government about to announce guidance tying prenatal Tylenol use to autism, a move reportedly championed by HHS Secretary Robert F. Kennedy Jr. ?",452,299,1nnuiew,https://www.reddit.com/r/PoliticalDiscussion/comments/1nnuiew/why_is_the_government_about_to_announce_guidance/
PoliticalDiscussion,"Why are American conservatives (Trump) so popular in Israel, whereas American Jews are predominantly Democrat?",336,184,1nnpbbf,https://www.reddit.com/r/PoliticalDiscussion/comments/1nnpbbf/why_are_american_conservatives_trump_so_popular/
PoliticalDiscussion,"If Perot won 1992 and ran for re-election in 1996, would he do better if his two opponents were both extremists (e.g. Pat Buchanan and Ralph Nader) or would he do better if his opponents were both moderates (e.g. Colin Powell and Lloyd Bensten)?",0,15,1noqumx,https://www.reddit.com/r/PoliticalDiscussion/comments/1noqumx/if_perot_won_1992_and_ran_for_reelection_in_1996/
PoliticalDiscussion,Trump says the tariffs are working and the US is getting richer from it. Is that true?,292,394,1nn6k1v,https://www.reddit.com/r/PoliticalDiscussion/comments/1nn6k1v/trump_says_the_tariffs_are_working_and_the_us_is/
PoliticalDiscussion,Will the Democratic Party be forced to adopt some anti-immigration policies to return to power?,0,176,1nohtk6,https://www.reddit.com/r/PoliticalDiscussion/comments/1nohtk6/will_the_democratic_party_be_forced_to_adopt_some/
PoliticalDiscussion,"UK, Canada, and Australia formally recognize Palestine — what does this mean for global diplomacy?",71,212,1nmzepf,https://www.reddit.com/r/PoliticalDiscussion/comments/1nmzepf/uk_canada_and_australia_formally_recognize/
PoliticalDiscussion,Would it be better for US President (or other World Leaders) to not tie themselves to a political party ?,0,13,1no63e2,https://www.reddit.com/r/PoliticalDiscussion/comments/1no63e2/would_it_be_better_for_us_president_or_other/
PoliticalDiscussion,Do you think Democrats should change their federal platform?,0,82,1nnu2r8,https://www.reddit.com/r/PoliticalDiscussion/comments/1nnu2r8/do_you_think_democrats_should_change_their/
PoliticalDiscussion,"Do oppressed groups have a duty, not just a right, to resist systemic threats, and if so, what methods are justified?",0,67,1nmo35z,https://www.reddit.com/r/PoliticalDiscussion/comments/1nmo35z/do_oppressed_groups_have_a_duty_not_just_a_right/
PoliticalDiscussion,Is using military force against suspected drug-trafficking boats constitutional or an overreach of presidential power?,139,277,1nlal7x,https://www.reddit.com/r/PoliticalDiscussion/comments/1nlal7x/is_using_military_force_against_suspected/
PoliticalDiscussion,"What are your thoughts on the FCC's crackdown on Jimmy Kimmel, Stephen Colbert and free speech in general?",161,279,1nl6nez,https://www.reddit.com/r/PoliticalDiscussion/comments/1nl6nez/what_are_your_thoughts_on_the_fccs_crackdown_on/
PoliticalDiscussion,"When Putin came to power in the 2000s his administration critiqued a puppet show mocking politicians openly. 2 years later the puppet show was taken down, do you see parallels with the events we are currently on?",148,28,1nl0uwa,https://www.reddit.com/r/PoliticalDiscussion/comments/1nl0uwa/when_putin_came_to_power_in_the_2000s_his/
PoliticalDiscussion,"Has US political support for Israel become a kind of cult, and how does Reagan’s 1982 diary entry highlight the difference between then and now?",47,66,1nl71xy,https://www.reddit.com/r/PoliticalDiscussion/comments/1nl71xy/has_us_political_support_for_israel_become_a_kind/
PoliticalDiscussion,"Do you think the majority of Americans aren't hyper-partisan/tribal, or has that ship sailed?",60,185,1nl4px7,https://www.reddit.com/r/PoliticalDiscussion/comments/1nl4px7/do_you_think_the_majority_of_americans_arent/
PoliticalDiscussion,"What is ""fair"" for taxes?",0,218,1nm2c8v,https://www.reddit.com/r/PoliticalDiscussion/comments/1nm2c8v/what_is_fair_for_taxes/
PoliticalDiscussion,Current Leaders Of The Democratic Party?,76,205,1nkroke,https://www.reddit.com/r/PoliticalDiscussion/comments/1nkroke/current_leaders_of_the_democratic_party/
worldnews,"/r/WorldNews Live Thread: Russian Invasion of Ukraine Day 1308, Part 1 (Thread #1455)",586,201,1np2gzu,https://www.reddit.com/live/18hnzysb1elcs
worldnews,Russia says no choice but war after Trump U-turn on Ukraine,8819,743,1npqyab,https://www.aljazeera.com/news/2025/9/24/russia-says-no-choice-but-war-after-trump-u-turn-on-ukraine
worldnews,"Shooting down Russian jets ‘on the table,’ von der Leyen says",2899,102,1npp67c,https://www.politico.eu/article/ursula-von-der-leyen-russia-nato-airspace/
worldnews,"Canada signs ‘game-changing’ trade deal with Indonesia, new defence pact",1621,119,1npry8b,https://globalnews.ca/news/11449417/canada-indonesia-trade-agreement/
worldnews,"'Roger that' — Poland, Estonia welcome Trump's calls to shoot down Russian jets",11125,365,1npd091,https://kyivindependent.com/poland-estonia-react-to-trumps-calls-to-shoot-down-russian-fighter-jets/
worldnews,Huntington's disease successfully treated for the first time.,26318,559,1np9ix2,https://www.bbc.com/news/articles/cevz13xkxpro
worldnews,"Panama Revokes Over 200 Russian Tankers, Joins Ukraine’s Push for Child Return",1026,20,1npsjx5,https://united24media.com/latest-news/panama-revokes-over-200-russian-tankers-joins-ukraines-push-for-child-return-11938
worldnews,23 miners rescued after 43 hours trapped in Colombian gold mine,1307,19,1npq5ul,https://abcnews.go.com/amp/Business/wireStory/23-miners-rescued-after-43-hours-trapped-colombian-125905021
worldnews,Colombia's president calls US attacks on alleged drug boats 'act of tyranny',661,72,1nptus5,https://www.bbc.co.uk/news/articles/cy8rjp178mno
worldnews,Italy to recognize Palestine only if Hamas is excluded and all hostages freed,11973,648,1np774n,https://www.jpost.com/international/article-868429
worldnews,Hamas fires on IDF troops from Gaza’s largest hospital as Israeli forces advance,3718,788,1npb9h1,https://www.ynetnews.com/article/hj7wd8b2gg#autoplay
worldnews,Russia Delivers MiG-29 Jets to Iran Air Force,2707,231,1npd975,https://www.newsweek.com/russia-delivers-mig-29-jets-iran-air-force-10479982?utm_source=reddit&utm_campaign=reddit_influencers
worldnews,New Zealand loosens residency restrictions as record number of citizens leave,7932,685,1np6nt3,https://www.theguardian.com/world/2025/sep/23/new-zealand-visa-country-loosens-residency-restrictions-record-numbers-of-citizens-leave
worldnews,Ukraine Hits Black Sea Fleet in Novorossiysk as Chaos Reported Across Russian Black Sea Regions,2172,34,1npe400,https://www.kyivpost.com/post/60783
worldnews,Ukraine’s president says the world is in ‘the most destructive arms race in history’,1994,73,1npedbc,https://apnews.com/article/ukraine-zelenskyy-unga-united-nations-russia-ce276671d255befeba10a324caf2a7e5
worldnews,"Unite to end wars and tackle climate crisis, Australian PM tells UN in veiled swipe at US isolationism",251,28,1npttg2,https://www.theguardian.com/world/2025/sep/25/unite-to-end-wars-and-tackle-climate-crisis-australian-pm-tells-un-in-veiled-swipe-at-us-isolationism
worldnews,World’s oceans fail key health check as acidity crosses critical threshold for marine life,551,38,1npnhtj,https://www.theguardian.com/environment/2025/sep/24/worlds-oceans-fail-key-health-check-as-acidity-crosses-critical-threshold-for-marine-life
worldnews,‘We Can’t Just Swap Territories’: Zelensky Says Trump Finally Understands Ukraine’s Position,6035,166,1np5s9g,https://www.kyivpost.com/post/60744
worldnews,Hamas reportedly preparing for street-to-street fighting as Israeli forces near Gaza City centre,1130,295,1npg61a,https://www.bbc.co.uk/news/articles/c4gk9dreldxo
worldnews,"Russia to Trump: We’re a real bear, not a paper tiger",2690,471,1np9175,https://www.politico.eu/article/russia-donald-trump-comments-real-bear-not-paper-tiger/
